<?xml version="1.0" encoding="utf-8"?>
<xs:schema elementFormDefault="qualified" xmlns:xs="http://www.w3.org/2001/XMLSchema" targetNamespace="theatre" xmlns="theatre">
<xs:element name="data">
    <xs:complexType>
      <xs:choice maxOccurs="unbounded" minOccurs="0">
        <xs:element name="theatre">
          <xs:complexType>
            <xs:sequence>
              <xs:element type="xs:string" name="name"/>
              <xs:element name="address">
                <xs:complexType>
                  <xs:sequence>
                    <xs:element type="xs:float" name="zipcode"/>
                    <xs:element type="xs:string" name="country"/>
                    <xs:element type="xs:string" name="city"/>
                  </xs:sequence>
                </xs:complexType>
              </xs:element>
            </xs:sequence>
            <xs:attribute type="xs:string" name="id"/>
            <xs:attribute type="xs:string" name="principalid"/>
            <xs:attribute type="xs:string" name="showid"/>
          </xs:complexType>
        </xs:element>
        <xs:element name="principal">
          <xs:complexType>
            <xs:sequence>
              <xs:element type="xs:string" name="name"/>
            </xs:sequence>
            <xs:attribute type="xs:string" name="id"/>
          </xs:complexType>
        </xs:element>
        <xs:element name="show" maxOccurs="unbounded" minOccurs="0">
          <xs:complexType>
            <xs:sequence>
              <xs:element type="xs:string" name="title"/>
              <xs:element type="xs:string" name="genre"/>
              <xs:element type="xs:string" name="length"/>
              <xs:element type="xs:string" name="director"/>
            </xs:sequence>
            <xs:attribute type="xs:string" name="id" use="optional"/>
            <xs:attribute type="xs:string" name="actorid" use="optional"/>
            <xs:attribute type="xs:string" name="ticketid" use="optional"/>
          </xs:complexType>
        </xs:element>
        <xs:element name="actor">
          <xs:complexType>
            <xs:sequence>
              <xs:element type="xs:string" name="name"/>
              <xs:element name="datedata">
                <xs:complexType>
                  <xs:sequence>
                    <xs:element type="xs:string" name="dateplace"/>
                    <xs:element type="xs:date" name="datetime"/>
                  </xs:sequence>
                </xs:complexType>
              </xs:element>
              <xs:element type="xs:string" name="dramagroup"/>
            </xs:sequence>
            <xs:attribute type="xs:string" name="id" use="optional"/>
          </xs:complexType>
        </xs:element>
        <xs:element name="ticket" maxOccurs="unbounded" minOccurs="0">
          <xs:complexType>
            <xs:sequence>
              <xs:element type="xs:string" name="category"/>
              <xs:element type="xs:float" name="price"/>
            </xs:sequence>
            <xs:attribute type="xs:string" name="id" use="optional"/>
          </xs:complexType>
        </xs:element>
      </xs:choice>
    </xs:complexType>
  </xs:element>
</xs:schema>